"Status","Start Time","Stop Time","Duration in ms","Parent Suite","Suite","Sub Suite","Test Class","Test Method","Name","Description"
"passed","Tue Nov 05 14:30:32 GMT 2024","Tue Nov 05 14:30:40 GMT 2024","8041","chromium","","DNS Records","","","TC_04_04 | ""Hosted zones - DNS Record - Create with all fields NS","Verify DNS Record created with all fields."
"passed","Tue Nov 05 14:32:04 GMT 2024","Tue Nov 05 14:32:06 GMT 2024","2595","chromium","","Unauthorized user","","","TC_09_01|  Verify that non authorized user can navigate through  Blog page","Verify that Blog page is accessible for non authorized user"
"passed","Tue Nov 05 14:31:48 GMT 2024","Tue Nov 05 14:31:53 GMT 2024","4695","chromium","","My profile","","","TC_08_06 | Verify the user can change currency USD (EUR) in the Profile Menu","To verify, that the user can change currency USD (EUR) in the Profile Menu"
"passed","Tue Nov 05 14:32:09 GMT 2024","Tue Nov 05 14:32:11 GMT 2024","2599","chromium","","Unauthorized user","","","TC_09_01|  Verify that non authorized user can navigate through  ReportAbuse page","Verify that ReportAbuse page is accessible for non authorized user"
"passed","Tue Nov 05 14:29:21 GMT 2024","Tue Nov 05 14:29:26 GMT 2024","4698","chromium","","Authorization","","","TC_02_02 |  Verify user can login into their account without 2FA.","To verify user login process without 2FA."
"passed","Tue Nov 05 14:32:14 GMT 2024","Tue Nov 05 14:32:20 GMT 2024","5273","chromium","","Unauthorized user","","","TC_09_02_01|  Verify unauthorized user can search available domains (no filters)","Verify that unauthorized user can search available domains (no filters)"
"passed","Tue Nov 05 14:31:58 GMT 2024","Tue Nov 05 14:32:01 GMT 2024","2761","chromium","","Unauthorized user","","","TC_09_01|  Verify that non authorized user can navigate through  WhoIs page","Verify that WhoIs page is accessible for non authorized user"
"passed","Tue Nov 05 14:31:53 GMT 2024","Tue Nov 05 14:31:56 GMT 2024","2682","chromium","","Unauthorized user","","","TC_09_01|  Verify that non authorized user can navigate through  Transfer page","Verify that Transfer page is accessible for non authorized user"
"passed","Tue Nov 05 14:29:16 GMT 2024","Tue Nov 05 14:29:19 GMT 2024","2933","chromium","","Registration","","","TC_01_02_02 | Verify user is not able to sign up with an invalid email: without domain","Verify that registration fails when an invalid email is used"
"passed","Tue Nov 05 14:29:31 GMT 2024","Tue Nov 05 14:29:38 GMT 2024","7124","chromium","","DNS Records","","","TC_04_11 | ""Add new DNS-record modal - verify copy button adds text to clipboard.","Verify copy button works properly."
"passed","Tue Nov 05 14:31:40 GMT 2024","Tue Nov 05 14:31:48 GMT 2024","7750","chromium","","My profile","","","TC_08_02_03 | Verify the user can enable/disable Two-factor authentication (2FA)","Verify the user can enable/disable Two-factor authentication (2FA)"
"skipped","Tue Nov 05 14:29:31 GMT 2024","Tue Nov 05 14:29:31 GMT 2024","1","chromium","","Authorization","","","TC_02_04 | Account Deletion Without 2FA",""
"passed","Tue Nov 05 14:29:52 GMT 2024","Tue Nov 05 14:29:59 GMT 2024","7765","chromium","","DNS Records","","","TC_04_04 | ""Hosted zones - DNS Record - Create with all fields A","Verify DNS Record created with all fields."
"passed","Tue Nov 05 14:30:48 GMT 2024","Tue Nov 05 14:30:54 GMT 2024","6266","chromium","","Search domains","","","TC_04_09_01 | Verify user can search the registered domain","To verify, that user is able to search the registered domain in WhoIs"
"passed","Tue Nov 05 14:32:12 GMT 2024","Tue Nov 05 14:32:14 GMT 2024","2725","chromium","","Unauthorized user","","","TC_09_01|  Verify that non authorized user can navigate through  ContactUs page","Verify that ContactUs page is accessible for non authorized user"
"passed","Tue Nov 05 14:31:30 GMT 2024","Tue Nov 05 14:31:36 GMT 2024","6074","chromium","","Help center","","","TC_07_01_03 | Verify  the autocomplete suggestions displayed correspond to the entered letters in Help Center","Verify that user can see autocomplete suggestions correspond to the entered letters in Help Center"
"passed","Tue Nov 05 14:32:06 GMT 2024","Tue Nov 05 14:32:09 GMT 2024","2623","chromium","","Unauthorized user","","","TC_09_01|  Verify that non authorized user can navigate through  HelpCenter page","Verify that HelpCenter page is accessible for non authorized user"
"passed","Tue Nov 05 14:31:56 GMT 2024","Tue Nov 05 14:31:58 GMT 2024","2458","chromium","","Unauthorized user","","","TC_09_01|  Verify that non authorized user can navigate through  HomePage page","Verify that HomePage page is accessible for non authorized user"
"passed","Tue Nov 05 14:29:38 GMT 2024","Tue Nov 05 14:29:45 GMT 2024","6957","chromium","","DNS Records","","","TC_04_12 | ""Add new DNS-record modal - verify info tooltip appeared.","Verify copy button works properly."
"passed","Tue Nov 05 14:29:59 GMT 2024","Tue Nov 05 14:30:08 GMT 2024","8370","chromium","","DNS Records","","","TC_04_04 | ""Hosted zones - DNS Record - Create with all fields AAAA","Verify DNS Record created with all fields."
"passed","Tue Nov 05 14:32:01 GMT 2024","Tue Nov 05 14:32:04 GMT 2024","2792","chromium","","Unauthorized user","","","TC_09_01|  Verify that non authorized user can navigate through  SSLCertificates page","Verify that SSLCertificates page is accessible for non authorized user"
"passed","Tue Nov 05 14:32:20 GMT 2024","Tue Nov 05 14:32:24 GMT 2024","4383","chromium","","Unauthorized user","","","TC_09_02_02|  Verify unauthorized user can search occupied domains (no filters)","Verify that unauthorized user can search occupied domains (no filters)"
"passed","Tue Nov 05 14:29:13 GMT 2024","Tue Nov 05 14:29:16 GMT 2024","3321","chromium","","Registration","","","TC_01_02_02 | Verify user is not able to sign up with an invalid email: without @","Verify that registration fails when an invalid email is used"
"passed","Tue Nov 05 14:30:16 GMT 2024","Tue Nov 05 14:30:23 GMT 2024","7826","chromium","","DNS Records","","","TC_04_04 | ""Hosted zones - DNS Record - Create with all fields DS","Verify DNS Record created with all fields."
"passed","Tue Nov 05 14:31:14 GMT 2024","Tue Nov 05 14:31:21 GMT 2024","7030","chromium","","Hosted zones","","","TC_04_03_02 | Verify user can delete hosted zone","To verify, that user is able to delete hosted zone"
"skipped","Tue Nov 05 14:31:40 GMT 2024","Tue Nov 05 14:31:40 GMT 2024","0","chromium","","My profile","","","TC_08_02_02 | Verify user can change Password when 2FA is disabled",""
"passed","Tue Nov 05 14:29:26 GMT 2024","Tue Nov 05 14:29:31 GMT 2024","4900","chromium","","Authorization","","","TC_02_01 | Verify login with invalid credentials.","To verify user is not able to login with empty and invalid credentials."
"passed","Tue Nov 05 14:30:59 GMT 2024","Tue Nov 05 14:31:12 GMT 2024","13290","chromium","","Search Hosted Zones","","","TC_04_02 | Verify search by hosted zone name","To verify, that user is able to search a hosted zone by name"
"passed","Tue Nov 05 14:30:08 GMT 2024","Tue Nov 05 14:30:16 GMT 2024","7773","chromium","","DNS Records","","","TC_04_04 | ""Hosted zones - DNS Record - Create with all fields CNAME","Verify DNS Record created with all fields."
"passed","Tue Nov 05 14:30:54 GMT 2024","Tue Nov 05 14:30:59 GMT 2024","4909","chromium","","Search domains","","","TC_04_09_02 | Verify user can search the non-registered domain in Whois page","To verify that user is able to search the non-registered domain in WhoIs"
"passed","Tue Nov 05 14:29:19 GMT 2024","Tue Nov 05 14:29:21 GMT 2024","1985","chromium","","Registration","","","TC_01_02_02 | Verify user is not able to sign up with an invalid email: domain less than 2 characters","Verify that registration fails when an invalid email is used"
"passed","Tue Nov 05 14:29:08 GMT 2024","Tue Nov 05 14:29:12 GMT 2024","3798","chromium","","Registration","","","TC_01_02_01 | Verify user is not able to sign up with an existing email","Verify that registration fails when an existing email is used"
"passed","Tue Nov 05 14:30:40 GMT 2024","Tue Nov 05 14:30:48 GMT 2024","7947","chromium","","DNS Records","","","TC_04_04 | ""Hosted zones - DNS Record - Create with all fields TXT","Verify DNS Record created with all fields."
"passed","Tue Nov 05 14:31:21 GMT 2024","Tue Nov 05 14:31:29 GMT 2024","8099","chromium","","DNSSEC","","","TC_04_08 | Verify user can enable DNSSEC","To verify DNSSEC can be enabled"
"passed","Tue Nov 05 14:29:45 GMT 2024","Tue Nov 05 14:29:52 GMT 2024","6959","chromium","","DNS Records","","","TC_04_10 | ""Add new DNS-record"" modal was closed by Cancel or by X button","Verify DNS Record with required fields"
"passed","Tue Nov 05 14:31:36 GMT 2024","Tue Nov 05 14:31:40 GMT 2024","4372","chromium","","My profile","","","TC_08_01 | Verify the Profile Dropdown Menu is displayed on ""My Profile"" Button Click","To verify the Profile Dropdown Menu on clicking ""My Profile"
"passed","Tue Nov 05 14:30:23 GMT 2024","Tue Nov 05 14:30:32 GMT 2024","8104","chromium","","DNS Records","","","TC_04_04 | ""Hosted zones - DNS Record - Create with all fields MX","Verify DNS Record created with all fields."
