"Status","Start Time","Stop Time","Duration in ms","Parent Suite","Suite","Sub Suite","Test Class","Test Method","Name","Description"
"passed","Thu Nov 28 20:34:59 GMT 2024","Thu Nov 28 20:35:03 GMT 2024","4358","chromium","09NonAuthorizedUser.spec.js","Unauthorized user","","","TC_09_03_03 | Verify that activating the 'Hide registered' toggle displays only unregistered domains in the search results, 'Reset' and 'X' buttons","Verify that activating the 'Hide registered' toggle displays only unregistered domains in the search results, 'Reset' and 'X' buttons"
"passed","Thu Nov 28 20:27:49 GMT 2024","Thu Nov 28 20:27:53 GMT 2024","4491","chromium","03Navigation.spec.js","Navigation","","","TC_03_02_02 | Verify navigation to Home page from fromFooterDomainSearch","To verify that user can navigate to Home page from fromFooterDomainSearch."
"passed","Thu Nov 28 20:28:55 GMT 2024","Thu Nov 28 20:29:02 GMT 2024","7246","chromium","04Domains.spec.js","DNS Records","","","TC_04_04 | ""Hosted zones - DNS Record - Create with all fields CNAME","Verify DNS Record created with all fields."
"passed","Thu Nov 28 20:27:17 GMT 2024","Thu Nov 28 20:27:22 GMT 2024","4869","chromium","03Navigation.spec.js","Navigation","","","TC_03_01_05 |  Verify that user can navigate through Header links Hosting","To verify that user can navigate through Header links."
"passed","Thu Nov 28 20:30:10 GMT 2024","Thu Nov 28 20:30:17 GMT 2024","7091","chromium","04Domains.spec.js","DNS Records","","","TC_04_05 | ""Hosted zones - DNS Record - Create with required fields NS. Ignored optional fields","Verify DNS Record with required fields."
